{
    "$schema": "http://json-schema.org/draft-07/schema#",
    "$id": "https://ploinky.local/local-llm-architectures/catalog.schema.json",
    "title": "Local LLM Architecture Catalog",
    "type": "object",
    "additionalProperties": false,
    "required": ["schemaVersion", "catalogId", "architectures", "images"],
    "properties": {
        "schemaVersion": { "type": "integer", "const": 1 },
        "catalogId": { "type": "string", "minLength": 1, "maxLength": 200 },
        "updatedAt": { "type": "string", "maxLength": 64 },
        "defaultFallback": { "type": "string", "minLength": 1, "maxLength": 64 },
        "architectures": {
            "type": "array",
            "minItems": 1,
            "items": {
                "type": "object",
                "additionalProperties": false,
                "required": ["id", "path"],
                "properties": {
                    "id": { "type": "string", "pattern": "^[a-z0-9][a-z0-9._-]{0,63}$" },
                    "path": { "type": "string", "pattern": "^architectures/[A-Za-z0-9._-]+\\.json$" }
                }
            }
        },
        "images": {
            "type": "array",
            "minItems": 1,
            "items": {
                "type": "object",
                "additionalProperties": false,
                "required": ["id", "path"],
                "properties": {
                    "id": { "type": "string", "pattern": "^[a-z0-9][a-z0-9._-]{0,63}$" },
                    "path": { "type": "string", "pattern": "^images/[A-Za-z0-9._-]+\\.json$" }
                }
            }
        }
    }
}
